{
  "chip": "ATmega328P",
  "datasheet": "ATmega328P Datasheet (DS40002061B)",
  "registers": {
    "UDR0": {
      "documentation": [
        "See ATMega328p Datasheet Section 36 Register Summary",
        "The USART Transmit Data Buffer Register and USART Receive Data Buffer Registers share the same I/O address referred to as",
        "USART Data Register or UDRn. The Transmit Data Buffer Register (TXB) will be the destination for data written to the UDRn",
        "Register location. Reading the UDRn Register location will return the contents of the Receive Data Buffer Register (RXB).",
        "",
        "For 5-, 6-, or 7-bit characters the upper unused bits will be ignored by the Transmitter and set to zero by the Receiver.",
        "",
        "The transmit buffer can only be written when the UDREn Flag in the UCSRnA Register is set. Data written to UDRn when the",
        "UDREn Flag is not set, will be ignored by the USART Transmitter. When data is written to the transmit buffer, and the",
        "Transmitter is enabled, the Transmitter will load the data into the Transmit Shift Register when the Shift Register is empty.",
        "Then the data will be serially transmitted on the TxDn pin.",
        "",
        "The receive buffer consists of a two level FIFO. The FIFO will change its state whenever the receive buffer is accessed. Due",
        "to this behavior of the receive buffer, do not use Read-Modify-Write instructions (SBI and CBI) on this location. Be careful",
        "when using bit test instructions (SBIC and SBIS), since these also will change the state of the FIFO."
      ]
    },
    "UBRR0": {
      "documentation": [
        "```",
        "--------------------------------------------------------------------------------",
        "| Bit          |   7   |   6   |   5   |   4   |   3   |   2   |   1   |   0   |",
        "--------------------------------------------------------------------------------",
        "|              |   -   |   -   |   -   |   -   |         UBRRn[12:8]           |",
        "|              |                       UBRRn[7:0]                              |",
        "--------------------------------------------------------------------------------",
        "| Read/Write   |  R/W  |  R/W  |  R/W  |  R/W  |  R/W  |  R/W  |  R/W  |  R/W  |",
        "--------------------------------------------------------------------------------",
        "| InitialValue |   0   |   0   |   0   |   0   |   0   |   0   |   0   |   0   |",
        "--------------------------------------------------------------------------------",
        "```",
        "Bits 15 through 12 are reserved for future use. For compatibility with future devices, these bit must be written to zero",
        "when UBRRnH is written.",
        "",
        "This is a 12-bit register which contains the USART baud rate. The UBRRnH contains the four most significant bits, and the",
        "UBRRnL contains the eight least significant bits of the USART baud rate. Ongoing transmissions by the Transmitter and Receive",
        "will be corrupted if the baud rate is changed. Writing UBRRnL will trigger an immediate update of the baud rate prescaler."
      ],
      "documentationL": [
        "This is a 12-bit register which contains the USART baud rate. The UBRRnH contains the four most significant bits, and the",
        "UBRRnL contains the eight least significant bits of the USART baud rate. Ongoing transmissions by the Transmitter and Receiver",
        "will be corrupted if the baud rate is changed. Writing UBRRnL will trigger an immediate update of the baud rate prescaler."
      ],
      "documentationH": [
        "Bits 15 through 12 are reserved for future use. For compatibility with future devices, these bit must be written to zero",
        "when UBRRnH is written.",
        "",
        "This is a 12-bit register which contains the USART baud rate. The UBRRnH contains the four most significant bits, and the",
        "UBRRnL contains the eight least significant bits of the USART baud rate. Ongoing transmissions by the Transmitter and Receiver",
        "will be corrupted if the baud rate is changed. Writing UBRRnL will trigger an immediate update of the baud rate prescaler."
      ]
    },
    "ADMUX": {
      "documentation": [
        "ADMUX - ADC Multiplexer Selection Register",
        "```",
        "--------------------------------------------------------------------------------",
        "| Bit          |   7   |   6   |   5   |   4   |   3   |   2   |   1   |   0   |",
        "--------------------------------------------------------------------------------",
        "| (0x7C)       | REFS1 | REFS0 | ADLAR |   -   |  MUX3 |  MUX2 |  MUX1 |  MUX0 |",
        "--------------------------------------------------------------------------------",
        "| Read/Write   |  R/W  |  R/W  |  R/W  |   R   |  R/W  |  R/W  |  R/W  |  R/W  |",
        "--------------------------------------------------------------------------------",
        "| InitialValue |   0   |   0   |   0   |   0   |   0   |   0   |   0   |   0   |",
        "--------------------------------------------------------------------------------",
        "```"
      ]
    },
    "ADC": {
      "documentation": [
        "```",
        "--------------------------------------------------------------------------------",
        "| Bit          |   7   |   6   |   5   |   4   |   3   |   2   |   1   |   0   |",
        "--------------------------------------------------------------------------------",
        "NORMAL",
        "| (0x79)       |   -   |   -   |   -   |   -   |   -   |   -   | ADC9  | ADC8  |",
        "| (0x78)       | ADC7  | ADC6  | ADC5  | ADC4  | ADC3  | ADC2  | ADC1  | ADC0  |",
        "LEFT-ALIGNED",
        "| (0x79)       | ADC9  | ADC8  | ADC7  | ADC6  | ADC5  | ADC4  | ADC3  | ADC2  |",
        "| (0x78)       | ADC1  | ADC0  |   -   |   -   |   -   |   -   |   -   |   -   |",
        "--------------------------------------------------------------------------------",
        "| Read/Write   |   R   |   R   |   R   |   R   |   R   |   R   |   R   |   R   |",
        "| Read/Write   |   R   |   R   |   R   |   R   |   R   |   R   |   R   |   R   |",
        "--------------------------------------------------------------------------------",
        "| InitialValue |   0   |   0   |   0   |   0   |   0   |   0   |   0   |   0   |",
        "| InitialValue |   0   |   0   |   0   |   0   |   0   |   0   |   0   |   0   |",
        "--------------------------------------------------------------------------------",
        "```"
      ],
      "documentationL": [
        "ADCL - ADC Data Register (low bits)",
        "```",
        "--------------------------------------------------------------------------------",
        "| Bit          |   7   |   6   |   5   |   4   |   3   |   2   |   1   |   0   |",
        "--------------------------------------------------------------------------------",
        "NORMAL",
        "| (0x78)       | ADC7  | ADC6  | ADC5  | ADC4  | ADC3  | ADC2  | ADC1  | ADC0  |",
        "LEFT-ALIGNED",
        "| (0x78)       | ADC1  | ADC0  |   -   |   -   |   -   |   -   |   -   |   -   |",
        "--------------------------------------------------------------------------------",
        "| Read/Write   |   R   |   R   |   R   |   R   |   R   |   R   |   R   |   R   |",
        "--------------------------------------------------------------------------------",
        "| InitialValue |   0   |   0   |   0   |   0   |   0   |   0   |   0   |   0   |",
        "--------------------------------------------------------------------------------",
        "```"
      ],
      "documentationH": [
        "ADCH - ADC Data Register (high bits)",
        "```",
        "--------------------------------------------------------------------------------",
        "| Bit          |   7   |   6   |   5   |   4   |   3   |   2   |   1   |   0   |",
        "--------------------------------------------------------------------------------",
        "NORMAL",
        "| (0x79)       |   -   |   -   |   -   |   -   |   -   |   -   | ADC9  | ADC8  |",
        "LEFT-ALIGNED",
        "| (0x79)       | ADC9  | ADC8  | ADC7  | ADC6  | ADC5  | ADC4  | ADC3  | ADC2  |",
        "--------------------------------------------------------------------------------",
        "| Read/Write   |   R   |   R   |   R   |   R   |   R   |   R   |   R   |   R   |",
        "--------------------------------------------------------------------------------",
        "| InitialValue |   0   |   0   |   0   |   0   |   0   |   0   |   0   |   0   |",
        "--------------------------------------------------------------------------------",
        "```"
      ]
    },
    "ADCSRA": {
      "documentation": [
        "ADCSRA - ADC Control and Status Register A",
        "```",
        "--------------------------------------------------------------------------------",
        "| Bit          |   7   |   6   |   5   |   4   |   3   |   2   |   1   |   0   |",
        "--------------------------------------------------------------------------------",
        "| (0x7A)       | ADEN  |  ADSC | ADATE | ADIF  | ADIE  | ADPS2 | ADPS1 | ADPS0 |",
        "--------------------------------------------------------------------------------",
        "| Read/Write   |  R/W  |  R/W  |  R/W  |  R/W  |  R/W  |  R/W  |  R/W  |  R/W  |",
        "--------------------------------------------------------------------------------",
        "| InitialValue |   0   |   0   |   0   |   0   |   0   |   0   |   0   |   0   |",
        "--------------------------------------------------------------------------------",
        "```"
      ]
    },
    "ADCSRB": {
      "documentation": [
        "ADCSRB - ADC Control and Status Register B",
        "```",
        "--------------------------------------------------------------------------------",